uri,date,sim,url,title,body,source,authors,concepts,categories,storyUri,eventUri,shares,sentiment,place,country
7613567029,2023-06-27,0.7333333492279053,https://www.pcworld.com/article/1965450/avoid-home-networking-disaster-with-these-4-preventative-steps.html,4 preventative steps to avoid a home networking disaster,"Setting up a router can go fast -- so fast that you might skip a few steps or think to save them for later. Except later might come too late, as I recently discovered after an unexpected (and much unwanted) reset of my router. Device configuration and settings all gone in a second...and with no recoverable backup on hand.

I don't have a right to complain, since I know better. (Originally the router setup was meant to be ""temporary"" at the start of the pandemic, but then, well...) Instead, let me serve as a lesson that you can easily improve on, especially since other things can go badly with your home network if you don't set it up right. Take an extra 15 minutes and follow the following four steps -- and don't put some of them off, like I did.

Looking to encrypt your data? If so, check out PCWorld's roundup of the best VPN services available right now.

Let's start with the step I skipped and ultimately regretted.

Few people use strictly default settings on their router (and honestly, for better security, you shouldn't leave them as they are out of the box). Most folks at least change things like the name of their Wi-Fi network and its password. You may also have a guest network and parental controls in place, and possibly more granular tweaks like quality of service (QoS) settings.

Backing up your settings periodically is ideal -- every time you make a new adjustment, it's a good idea to create a new backup. You should be able to find the backup option pretty easily within your router settings, but if not, your router's manual should explain how to do so. It will save you time if you ever have to reset your router (or, in my case, you effectively reset the router through sheer dumb behavior). After the reset, you can load the file with your saved configuration and be back to status quo (or dang close to it) within just a few minutes.

Even if you don't backup every time you make a change, do so after you first get your router up and running. You'll have a baseline to work with should disaster strike.

You'll often get urged by tech journalists like me to keep your firmware updated for security reasons -- and that is true. Vulnerabilities can allow bad actors to gain access to your router and then spy on your network traffic, use your router to attack other devices on the wider internet, or just simply disable it.

There's another other main reason to stay up to date, though. Firmware updates often include fixes for bugs that can affect your router's functionality. In my case, my accidental router wipe happened due to older firmware causing periodic issues with logging into the device. I thought a reboot could help the problem. I accidentally ended up resetting my router instead.

The easy way to deal with this? Turn on automatic firmware updates for your router. Depending on the model you own, this can be full automatic updating, or automatic downloads that still require manual installation. If human intervention is involved, make it part of your PC's regular maintenance schedule to check up on your router every so often, too.

(For what it's worth, my setup required full manual downloading and updating, so while I was lazy, I was not outright ignoring options that would have made my life much simpler.)

Your Wi-Fi network needs a password -- and a good method of securing the traffic going to and from the router. Nowadays, most ","uri: pcworld.com, title: PCWorld, importance: 226244",Alaina Yee: pcworld,"uri: Router_(computing), type: wiki, score: 5, label: Router (computing); uri: Wi-Fi, type: wiki, score: 5, label: Wi-Fi; uri: Quality_of_service, type: wiki, score: 4, label: Quality of service; uri: Password, type: wiki, score: 4, label: Password; uri: Wi-Fi_Protected_Access, type: wiki, score: 3, label: Wi-Fi Protected Access; uri: Home_network, type: wiki, score: 3, label: Home network; uri: Parental_controls, type: wiki, score: 3, label: Parental controls; uri: Encryption, type: wiki, score: 3, label: Encryption; uri: Firmware, type: wiki, score: 3, label: Firmware; uri: Patch_(computing), type: wiki, score: 3, label: Patch (computing); uri: Virtual_private_network, type: wiki, score: 3, label: Virtual private network; uri: Network_traffic, type: wiki, score: 2, label: Network traffic; uri: Booting, type: wiki, score: 2, label: Booting; uri: Software_bug, type: wiki, score: 2, label: Software bug; uri: Internet, type: wiki, score: 2, label: Internet; uri: Wi-Fi_Protected_Setup, type: wiki, score: 1, label: Wi-Fi Protected Setup; uri: Cryptographic_protocol, type: wiki, score: 1, label: Cryptographic protocol; uri: Service_set_(802.11_network), type: wiki, score: 1, label: Service set (802.11 network); uri: Remote_desktop_software, type: wiki, score: 1, label: Remote desktop software; uri: Password_strength, type: wiki, score: 1, label: Password strength","uri: dmoz/Recreation/Humor/Useless_Pages, wgt: 100; uri: news/Technology, wgt: 97; uri: dmoz/Society/Relationships/Romance, wgt: 100; uri: dmoz/Computers/Internet/Etiquette, wgt: 100; uri: dmoz/Computers/Internet/E-mail, wgt: 100",eng-8730154,eng-8730154,15,0.2705882352941176,,
